id_seller,username,nama_toko,level_toko,premium_toko,id_produk,nama_produk,kategori,kondisi,rating,jumlah_rating,stok,jumlah_interest,jumlah_sold,jumlah_view,harga,harga_asli,diskon,deskripsi
230413328,riadi983,Ready,Juragan,platinum,4hmkpvm,Kaos Polos Lengan Pendek Pria Wanita Cotton Combed 24s Tebal Adem Nyaman Lembut Unisex Original,Kaos,Baru,0,0,15454,0,0,0,47000,47000,0,"DESKRIPSI PRODUK :<br><br/><br><br/> BAHAN COTTON COMBED 24S REAKTIF gramasi 170 - 190<br><br/>(LEBIH TEBAL DIBANDING 30S)<br><br/>1KG MUAT 6 pcs ukuran<br><br/> NO LABEL (HANYA SIZE SAJA) Cocok untuk usaha anda sablon / DISTRO dan aman bagi ressler dan Dropshiper <br><br/><br><br/>WARNA Combed  24s UKURAN M L XL :<br><br/>1 PINK BABY <br><br/>2 HIJAU BOTOL<br><br/>3 HIJAU ARMY<br><br/>4 ABU TUA<br><br/>5 MILO<br><br/>6 KUNING MUSTARD<br><br/>7 SUPER BLACK<br><br/>8 MERAH MAROON<br><br/>9 SUPER WHITE<br><br/>10 BLUE NAVY<br><br/>11 BABY BLUE<br><br/>12 LILAC<br><br/>13 AVOCADO<br><br/>14 ABU MISTY<br><br/>15 SALEM SOFT<br><br/>16 ZOLA<br><br/><br><br/> KUALITAS JAHITAN<br><br/> (JAHITAN OVERDECK 3 JARUM &amp; DOUBLE STICK,RANTAI) BERBEDA DARI YANG BEREDAR DIPASARAN.<br><br/><br><br/> UKURAN  KAMI REGULAR FIT JADI TERLIHAT NYAMAN SAAT DIGUNAKAN DAN DAPAT DIGUNAKAN PRIA MAUPUN WANITA<br><br/><br><br/> TOLERANSI UKURAN 2-3 CM <br><br/>M     49 X 72  ( 40 - 60 KG )<br><br/>L      51 X 74   ( 60 - 70 KG )<br><br/>XL    53 X 77   ( 70 - 90 KG )"
230413328,riadi983,Ready,Juragan,platinum,4hmkpta,Kaos Polos Lengan Pendek Pria Wanita Cotton Combed 30s Adem Lembut,Kaos,Baru,0,0,99999,0,0,0,37000,37000,0,"BANDINGKAN DENGAN TOKO SEBELAH ! BUKAN Cotton Combed Siluman , bukan Carded apalagi PE ASLI COTTON 100% BUKTIKAN SENDIRI !<br><br/><br><br/>Kami adalah SUPPLIER KAOS POLOS KUALITAS YOGYA / RAMAYANA / MATAHARI ! Bukan Tanah Abangan .<br><br/><br><br/>(HARGA TERMURAH DAN BERGARANSI .<br><br/> 100% ASLI COTTON COMBED 30s gak asli uang kembali !)<br><br/>(JIKA INGIN YANG TEBAL BELI DI KATALOG KITA YANG COTTON COMBED 24S )<br><br/><br><br/>Ready 22 warna<br><br/><br><br/>- Hitam <br><br/>- Putih<br><br/>- Navy<br><br/>- Abu Muda<br><br/>- Abu misty<br><br/>- Abu Tua<br><br/>- Merah Maroon<br><br/>- Merah Cabe<br><br/>- kuning Kenari<br><br/>- Kuning Mustard<br><br/>- Biru Benhur<br><br/>- Biru Turkis <br><br/>- Hijau botol<br><br/>- Hijau fuji<br><br/>- Hijau Army<br><br/>- Coklat tua<br><br/>- Pink Baby<br><br/>- Orange <br><br/>- Soft Tosca<br><br/>- Coklat susu <br><br/><br><br/>WARNA LAIN DI KATALOG YANG STUNYA YAH KAK.<br><br/><br><br/>Size Chart Pola<br><br/><br><br/>Ukuran = Lebar x Panjang<br><br/>Toleransi ukuran 2-3cm<br><br/><br><br/>M = 49 x 72 CM<br><br/><br><br/>L = 51 x 74 CM<br><br/><br><br/>XL = 53 x 77 CM"
230413328,riadi983,Ready,Juragan,platinum,4hmdkgd,Jubah Anak Laki Laki Gamis Saudi Anak Panjang Full Busana Muslim 3-14 Tahun,Busana Muslim Anak Laki-Laki,Baru,0,0,1154,0,0,0,125000,125000,0,"Bahan Katun Turkey (Bahan Lembut, Halus, Nyaman dan Tidak Gerah)<br><br/><br><br/>jubah anak laki-laki/gamis anak pria new motif dengan 2 saku <br><br/><br><br/>plus peci..<br><br/>produk original<br><br/>bahan katun turkey<br><br/> premium bahan adem,nyaman dan lembut..<br><br/>produk dengan sortiran terbaik<br><br/>produk salah satu KONVEKSI(MINI GARMENT) Terbesar jawa barat<br><br/>menerima dropshiper dan pembelian partai  lebih murah.<br><br/><br><br/>ukuran/size<br><br/><br><br/>NO.2(USIA 1-2 TAHUN)<br><br/>Panjang gamis=72 cm<br><br/>Lebar dada        =37 cm<br><br/>Panjang lengan=29 cm<br><br/><br><br/>NO.4(USIA 3-4 TAHUN)<br><br/>Panjang gamis=75cm<br><br/>Lebar dada        =40 cm<br><br/>Panjang lengan=31cm<br><br/><br><br/>NO.6(USIA 5-6 TAHUN)<br><br/>Panjang gamis=80 cm<br><br/>Lebar dada        =44 cm<br><br/>Panjang lengan=36 cm<br><br/><br><br/>NO.8(USIA 7-8 TAHUN)<br><br/>Panjang gamis=90 cm<br><br/>Lebar dada        =44cm<br><br/>Panjang lengan=38 cm<br><br/><br><br/>NO.10(USIA 9-10 THN)<br><br/>Panjang gamis =95 cm<br><br/>Lebar dada        =50 cm<br><br/>Panjang lengan=41 cm<br><br/><br><br/>NO.12(USIA 11-12 THN)<br><br/>Panjang gamis=105 cm<br><br/>Lebar dada        =53 cm<br><br/>Panjang lengan=44 cm<br><br/><br><br/>No.14(USIA 13-14 THN)<br><br/>Panjang gamis=111 cm<br><br/>Lebar dada        =57 cm<br><br/>Panjang lengan=48 cm<br><br/><br><br/>SELAMAT BERBELANJA <br><br/>SEMOGA BERKAH<br><br/>TERIMA KASIH..."
230413328,riadi983,Ready,Juragan,platinum,4hkxu7a,Jubah Gamis Anak Laki Laki Jubah Saudi Muslim,Busana Muslim Anak Laki-Laki,Baru,0,0,1142,0,0,0,125000,125000,0,"WARNA :<br><br/>PUTIH<br><br/>HITAM<br><br/>NAVY<br><br/>MARON <br><br/>MOCCA<br><br/>ABU<br><br/>HIJAU<br><br/><br><br/>Bahan Katun Turkey (Bahan Lembut, Halus, Nyaman dan Tidak Gerah)<br><br/><br><br/>jubah anak laki-laki/gamis anak pria new motif dengan 2 saku <br><br/><br><br/>plus peci..<br><br/>produk original<br><br/>bahan katun turkey<br><br/>premium bahan adem,nyaman dan lembut..<br><br/>produk dengan sortiran terbaik<br><br/>produk salah satu KONVEKSI(MINI GARMENT) Terbesar jawa barat<br><br/>menerima dropshiper dan pembelian partai  lebih murah.<br><br/><br><br/>ukuran/size<br><br/><br><br/>NO.4(USIA 3-4 TAHUN)<br><br/>Panjang gamis=75cm<br><br/>Lebar dada =40 cm<br><br/>Panjang lengan=31cm<br><br/><br><br/>NO.6(USIA 5-6 TAHUN)<br><br/>Panjang gamis=80 cm<br><br/>Lebar dada =44 cm<br><br/>Panjang lengan=36 cm<br><br/><br><br/>NO.8(USIA 7-8 TAHUN)<br><br/>Panjang gamis=90 cm<br><br/>Lebar dada =44cm<br><br/>Panjang lengan=38 cm<br><br/><br><br/>NO.10(USIA 9-10 THN)<br><br/>Panjang gamis =95 cm<br><br/>Lebar dada =50 cm<br><br/>Panjang lengan=41 cm<br><br/><br><br/>NO.12(USIA 11-12 THN)<br><br/>Panjang gamis=105 cm<br><br/>Lebar dada =53 cm<br><br/>Panjang lengan=44 cm<br><br/><br><br/>No.14(USIA 13-14 THN)<br><br/>Panjang gamis=111 cm<br><br/>Lebar dada =57 cm<br><br/>Panjang lengan=48 cm<br><br/><br><br/>SELAMAT BERBELANJA <br><br/>SEMOGA BERKAH<br><br/>TERIMA KASIH..."
230413328,riadi983,Ready,Juragan,platinum,4hkk774,jubah gamis katun embos anak laki laki baju muslim saudi pakistan koko 5-14 tahun,Busana Muslim Anak Laki-Laki,Baru,5,3,1451,4,3,0,140000,140000,0,"1. Memakai kancing jepret (kancing snap button) kualitas terbaik<br><br/>2. Desain terbaru, sehingga meningkatkan kepercayaan diri<br><br/>3. Semua produk REAL PICT<br><br/>4. Menggunakan kain BSY EMBOS PREMIUM grade A<br><br/>5. Jahitan rapi<br><br/>6. Kualitas dan kepuasan pelanggan NO 1<br><br/>7. Terdapat saku di sisi kanan dan di kiri atas<br><br/>8. Jahitan kuat supaya tidak gampang robek<br><br/>MAU ORDER BANYAK 50.100.200 harga bisa lebih murah<br><br/>3 JUBAH masih bisa 1 kg ongkir yaa = 1 kg<br><br/>7 jubah bisa 2 kg yaa<br><br/>Size = LD (Lingkar dada diukur dari kanan ke kiri) X PB<br><br/>(panjang baju jubah)<br><br/><br><br/>NO 6 (Usia 5-6)<br><br/>Lebar Dada = 80 CM<br><br/>Panjang Jubah = 85 CM<br><br/><br><br/>NO 8 (Usia 7-8)<br><br/>Lebar Dada = 84 CM<br><br/>Panjang Jubah = 90 CM<br><br/><br><br/>NO 10 (Usia 9-10)<br><br/>Lebar Dada = 92 CM<br><br/>Panjang Jubah = 100 CM<br><br/><br><br/>NO 12 (Usia 11-12)<br><br/>Lebar Dada = 96CM<br><br/>Panjang Jubah = 110 CM<br><br/><br><br/>NO 14 (Usia 13-14)<br><br/>Lebar Dada = 102 CM<br><br/>Panjang Jubah = 118CM<br><br/><br><br/>Note: Cek ukuran sbelum membeli. Panjang baju ini di atas<br><br/>mata kaki ya, tapi jauh di bawah lutut."
230413328,riadi983,Ready,Juragan,platinum,4hkk6pd,jubah gamis pria embos motif jubah arab saudi muslim Pakistan,Busana Muslim Pria,Baru,4.5,2,1421,1,4,0,148000,148000,0,"terbaik<br><br/>2. Desain terbaru, sehingga meningkatkan kepercayaan diri<br><br/>3. Semua produk REAL PICT<br><br/>4. Menggunakan kain BSY EMBOS PREMIUM grade A<br><br/>5. ahitan rapi<br><br/>6. Kualitas dan kepuasan pelanggan NO 1<br><br/>7. Terdapat saku di sisi kanan dan di kiri atas<br><br/>8. Jahitan kuat supaya tidak gampang robek<br><br/><br><br/>MAU ORDER BANYAK 50.100.200 harga bisa lebih murah<br><br/>3 JUBAH masih bisa 1 kg ongkir yaa = 1 kg<br><br/>7 jubah bisa 2 kg yaa<br><br/><br><br/>Size = LD (Lingkar dada diukur dari kanan ke kiri) X PB<br><br/>(panjang baju jubah)<br><br/>Ukuran M = LD 106 cm x PB 126 cm<br><br/>Perkiraan size M untuk orang TB 146-157 cm dan BB = 41-66 kg<br><br/>Ukuran L = LD 110 cm x PB 132 cm<br><br/>Perkiraan size L cocok untuk orang TB 151 - 170 cm dan BB = 51-72 kg<br><br/>Ukuran XL = LD 114 cm x PB 136 cm<br><br/>Perkiraan size cocok untuk orang TB 167-175 cm dan BB 52-76 kg<br><br/>Ukuran XXL = LD 120 cm x PB 140 cm<br><br/>Perkiraan size cocok untuk orang TB 173- 180 cm dan BB 75-82 Kg<br><br/><br><br/>Perkiraan ukuran <br><br/>S = remaja mulai 15,17,18.19 tahunan smpai dewasa yg biasa<br><br/>pakai uk. S<br><br/>M = Remaja dewaaa<br><br/>L = standar dewasa<br><br/>XL &amp; XXL ukuran dewasa untuk berbadan gemuk kami sudah<br><br/>sesuaikan dengan lebar dada.<br><br/>Note: Cek ukuran sbelum membeli. Panjang baju ini di atas<br><br/>mata kaki ya, tapi jauh di bawah lutut."
230413328,riadi983,Ready,Juragan,platinum,4hk6ni1,celana cargo panjang pria celana jogger surfing olahraga trening,Celana Panjang,Baru,0,0,1125,0,0,0,155000,155000,0,WARNA : <br><br/>HITAM<br><br/>ABU<br><br/>MOCCA<br><br/><br><br/>bahan cotton Combed twill<br><br/>pola slimfit<br><br/>size 28-36 (S-XL)<br><br/>(S) 27-28 : Panjang 92CM x Lingkar 72CM<br><br/>(M) 29-30 : Panjang 95CM X Lingkar 77CM <br><br/>(L) 31-32 : Panjang 98CM X Lingkar 82CM <br><br/>(XL) 33-34 : Panjang 101CM X Lingkar 87CM<br><br/><br><br/>MOHON KONFIRMASI VIA CHAT JIKA ADA YG PERLU DITANYAKAN.<br><br/><br><br/>HAPPY SHOPPING !!!
230413328,riadi983,Ready,Juragan,platinum,4hjng6j,Gamis Syari Hijab Baju Muslim Wanita,Busana Muslim Wanita,Baru,4,2,1450,1,2,0,125000,125000,0,WARNA:<br><br/>ARMY<br><br/>KUNING<br><br/>TOSCA<br><br/>UNGU MUDA<br><br/>MARON<br><br/>NAVY<br><br/>BIRU<br><br/>DUSTY<br><br/>CREAM<br><br/><br><br/>GAMIS WULAN<br><br/>BAHAN : MOSCREPE<br><br/>LINGKAR DADA : 114 CM<br><br/>PANJANG GAMIS : 140 CM<br><br/>LEBAR BAWAH : 230 CM<br><br/>BUSUI FRIENDLY : SLETING DEPAN<br><br/>ADA SAKU KANAN KIRI<br><br/>PINGGANG ADA TALI<br><br/>TANGAN KARET
230413328,riadi983,Ready,Juragan,platinum,4himmkm,Jubah Gamis Pria Muslim Jubah Saudi Pakistan,Busana Muslim Pria,Baru,3,1,1144,1,1,0,145000,145000,0,WARNA : <br><br/>HITAM<br><br/>PUTIH<br><br/>NAVY<br><br/>HIJAU<br><br/>ABU<br><br/>COKSU<br><br/>MARON<br><br/><br><br/>Bahan : BSWAI<br><br/>Model : Jubah Gamis<br><br/><br><br/>bahan lembutt adem dan tidak panas saat di pakai <br><br/>sangat recoment buat di pakai sholat/ pengajian / sehari2 <br><br/><br><br/><br><br/>SIZE M :<br><br/>lingkar dada 104cm<br><br/>panjang jubah 115cm <br><br/><br><br/><br><br/>SIZE L : <br><br/>lingkar dada 108cm<br><br/>panjang 118cm<br><br/><br><br/><br><br/>SIZE XL:<br><br/>lingkar dada 110cm<br><br/>panjang jubah 128cm<br><br/><br><br/>SIZE XXL<br><br/>lingkar dada 120cm<br><br/>panjang jubah 132cm
230413328,riadi983,Ready,Juragan,platinum,4hi0s24,Kemeja wanita panjang basic longsleeve baju atasan kerja casual  hem wanita,"Kemeja, Blouse",Baru,0,0,125,1,0,0,115000,115000,0,"Ready yang terbaru dari kami :<br><br/>Basic Longsleeve<br><br/>.<br><br/>SPESIFIKASI<br><br/>- Bahan Shakila<br><br/>- Bahan nyaman tidak lepek, dan tidak mudah kusut<br><br/>- Jahitan rapih<br><br/>- Aplikasi Saku + Kancing Depan<br><br/>.<br><br/>SIZE :<br><br/>Ukuran L - XL<br><br/>LD : 108 cm<br><br/>PB : 70 cm<br><br/>.<br><br/>PILIHAN WARNA<br><br/>- Bata<br><br/>- Denim<br><br/>- Mocca<br><br/>- Cream<br><br/>- Broken White"
230413328,riadi983,Ready,Juragan,platinum,4hho0mp,Rompi Parasut Bodyvest Motor Biker Jaket Rompi Gunung Pelindung Outdoor Camping Mancing,Jaket & Body Protector,Baru,0,0,1452,2,0,0,145000,145000,0,"Warna : <br><br/>hitam<br><br/>navy <br><br/>hijau<br><br/>abu maron<br><br/>hitam navy<br><br/>loreng abu<br><br/>loreng coklat<br><br/><br><br/>Outdoor Fashion Rompi Gunung Adventure Rompi Mancing Fishing Rapih Kuat Premium Quality<br><br/><br><br/>Rompi Aneka Warna Cocok Buat Bergaya di Akhir Pekan Buat Jalan Jalan Santai Buat Kemping Ceria Buat Hiking Buat Naik Gunung Buat Mancing Buat Traveling ke Luar Kota Model Keren, Jahitan Rapih, Bahan Tebal<br><br/><br><br/>Bahan : Taslan Tebal Lapisan Dacron <br><br/>Ukuran : L , XL , XXL<br><br/>Size Chart<br><br/>P x L ( Panjang x Lebar )<br><br/>L : 68 x 54<br><br/>Xl : 70 x 56<br><br/>XXL : 72 x 58"
230413328,riadi983,Ready,Juragan,platinum,4hh21r4,Raket Nyamuk Listrik Perangkap Nyamuk,Home Stuff,Baru,0,0,1248,0,0,0,75000,75000,0,Perangkap nyamuk Terlaris.<br><br/>untuk spesifikasi silahkan cek di gambar display.
230413328,riadi983,Ready,Juragan,platinum,4hfzl41,Sepatu Sneakers Pria Casual Kerja Sepatu Kets Sport Olahraga Running Tali Canvas,Sneaker Pria,Baru,0,0,1143,0,0,0,198000,198000,0,"WARNA : <br><br/>HITAM<br><br/>ABU<br><br/>Sepatu Pria Original 100%<br><br/>Sepatu Import 100%<br><br/>Sepatu Sneakers Kualitas bagus harga terjangkau<br><br/>Sepatu Running, Kaki bergerak leluasa<br><br/>Sepatu Slip on Lembut di dalam,Nyaman saat dipakai<br><br/>Sepatu Olahragas Anti slip, Tidak pengap, Tidak mudah lepas<br><br/>Sepatu Sport Model simple dan elegan, Trend Fashion<br><br/><br><br/>BONUS : FREE BOX &amp; KAOS KAKI<br><br/><br><br/>Fitur : Sol Berbahan Karet Jadi Terasa Empuk &amp; Nyaman Ketika Digunakan.<br><br/>Cocok Digunakan Untuk : Sekolah, Kuliah, Kerja, Traveling.<br><br/><br><br/>Size 39-44 <br><br/>Perincian Size <br><br/>39=24.5 cm <br><br/>40=25 cm <br><br/>41=25.5 cm <br><br/>42=26 cm <br><br/>43=26.5 cm <br><br/>44=27 cm"
230413328,riadi983,Ready,Juragan,platinum,4hfdgkg,Tas Selempang Pria Sling Bag Kulit Tas Slempang Bahu Hp Gendong Tenteng,Selempang,Baru,0,0,1125,1,0,0,199000,199000,0,"WARNA <br><br/>BLACK<br><br/>LIGHT BROWN<br><br/>DARK BROWN<br><br/><br><br/><br><br/>SPESIFIKASI PRODUK<br><br/><br><br/>Brand : CURREN<br><br/>Model : CR8618<br><br/>Quality : Premium+<br><br/>Tipe : Tas Selempang, Messenger Bag<br><br/>Panjang : 20cm<br><br/>Lebar : 5.5cm<br><br/>Tinggi : 24.5cm<br><br/>Bahan : Premium PU Leather<br><br/>Style : Messenger<br><br/>Berat : 540g<br><br/>Tempat Penyimpanan :<br><br/>- 1 di Bagian Depan<br><br/>- 3 di Bagian Tengah<br><br/>- 1 di Bagian Belakang"
230413328,riadi983,Ready,Juragan,platinum,4hfc931,Tas Selempang Bahu Pria Kulit Tas Slempang Premium Original,Selempang,Baru,0,0,1452,2,0,0,195000,195000,0,WARNA : <br><br/>BLACK<br><br/>LIGHT BROWN<br><br/>DARK BROWN<br><br/><br><br/>SPESIFIKASI PRODUK :<br><br/>Brand : CURREN<br><br/>Model : CR9525<br><br/>Quality : Premium+<br><br/>Tipe : Tas Selempang<br><br/>Panjang : 15.5cm<br><br/>Lebar : 4.5cm<br><br/>Tinggi : 31cm<br><br/>Bahan : Premium PU Leather<br><br/>Style : Messenger<br><br/>Berat : 500g<br><br/>Tempat Penyimpanan :<br><br/>- 3 di Bagian Depan<br><br/>- 2 di Bagian Tengah
230413328,riadi983,Ready,Juragan,platinum,4hb3w4a,Jam Tangan Pria Sport Digital Analog Tali Rubber Tahan Anti Air Water Resist Premium,Jam Tangan Analog Pria,Baru,0,0,1124,1,0,0,159000,159000,0,"SPESIFIKASI PRODUK<br><br/><br><br/>Brand : SANDA<br><br/>Model : 6008<br><br/>Features : Hours, Minute, Second, Calender, Alarm, EL- Backlight, 12/24h, Stopwatch, Shock Resistant, Dual Time<br><br/>Date : Date<br><br/>Case Diameter : 52cm<br><br/>Case Thickness : 1,8cm<br><br/>Band Width : 2,3cm<br><br/>Band Length : 24cm<br><br/>Case Shape : Round<br><br/>Case Material : Zinc Alloy<br><br/>Display : Digital Analog<br><br/>Movement : Japan Quartz<br><br/>Power Source : Battery<br><br/>Battery Power : Japan Maxell<br><br/>Band Material : PU<br><br/>Mirror : Toughened Glass<br><br/>Buckle Type : Pin Buckle<br><br/>Water Resistance: 5ATM"
230413328,riadi983,Ready,Juragan,platinum,4haxgzg,Sepatu Boots Classic Pria Wanita Murah Sepatu Kerja Kuliah Sekolah Sneakers Slip on Santai Premium,Boots,Baru,1,1,1451,0,1,0,78000,78000,0,"REAL Pick yA ka.. <br><br/><br><br/>Foto kami REAL PICTURE !<br><br/>#plus+ Box/dus<br><br/>TERSEDIA WARNA<br><br/>HITAM<br><br/>PUTIH<br><br/>MAROON<br><br/>NAVY<br><br/>ABU<br><br/>FULLBLACK<br><br/><br><br/>KENAPA HARUS BELI DI TOKO KAMI<br><br/>Kualitas Bagus<br><br/>Dalam Sepatu Lembut Gak bikin Lecet<br><br/>Lem Rapih &amp; kuat<br><br/>Qc Control Teliti<br><br/><br><br/>KELEBIHAN PRODUK KAMI : <br><br/><br><br/>1. Kualitas IMPORT BAGUS<br><br/>2. Harga kami sangat TERJANGKAU dengan KUALITAS BAIK, karena kami FIRST HAND SUPPLIER<br><br/>3. Barang sesuai dengan foto yg ada<br><br/> (plus+Box/Dus)<br><br/>""READY STOCK""<br><br/>-100% Baru<br><br/>-Ukuran: 36 - 42<br><br/>Size chart=<br><br/>No 3 size 36 22cm<br><br/>No 4 size 37 23cm<br><br/>No 5 size 38 24cm<br><br/>No 6 size 39 25cm<br><br/>No 7 size 40 26cm<br><br/>No 8 size 41 27cm<br><br/>No 9 size 42 28cm<br><br/>-Grade Ori Vietnam<br><br/>-KUALITAS Bagus.."
230413328,riadi983,Ready,Juragan,platinum,4haxgxp,Termurah Sepatu Pria Wanita Sneaker Sepatu Kerja Kuliah Sekolah Olahraga Run Santai Slip on,Sneaker Pria,Baru,0,0,1425,0,0,0,72000,72000,0,"Foto kami REAL PICTURE !<br><br/>Converse GRADE ORI <br><br/>1kg muat 2 pasang sepatu<br><br/>SEDIA WARNA<br><br/>^HITAM<br><br/>^MAROON<br><br/>^NAVY<br><br/>^ABU<br><br/>^PUTIH<br><br/>^kuning<br><br/><br><br/>POKSING: 24<br><br/><br><br/>KENAPA HARUS BELI DI TOKO KAMI<br><br/>Kualitas Bagus<br><br/>Dalam Sepatu Lembut Gak bikin Lecet<br><br/>insol dalam di jait strobel bukan di lem<br><br/>Lem Rapih &amp; kuat<br><br/>Qc Control Teliti<br><br/><br><br/>CHART SIZE :(ukuran cm insol itu dalam sepatu bukan luar) ini size luar ya lebih besar dri size lokal, <br><br/>36 no 3= insol22 cm<br><br/>37 no 4= insol23 cm<br><br/>38 no 5= insol24 cm<br><br/>39 no 6= insol25 cm<br><br/>40 no 7= insol26 cm<br><br/>41 no 8= insol 27 cm<br><br/>42 no 9= insol28 cm<br><br/><br><br/>KELEBIHAN PRODUK KAMI : <br><br/><br><br/>1. Kualitas BAGUS<br><br/>2. Harga kami sangat TERJANGKAU dengan KUALITAS BAIK, karena kami FIRST HAND SUPPLIER<br><br/>3. Barang sesuai dengan foto yg ada<br><br/>4. produk kami size import ya jadi lebih besar dari lokal jika biasa pakai size lokal jadi size impornya harus turun, bisa 1 size"
230413328,riadi983,Ready,Juragan,platinum,4h8upmm,Tas Anak Ransel Sekolah Backpack Bag Tk Sd Laki Laki Perempuan Korea,Tas,Baru,5,3,11422,1,3,0,60000,60000,0,"Tas anak lucu dan super murah dengan kualitas bagus :<br><br/>*Bahan : kanvas tebal<br><br/>*Ukuran : 40 x 28 cm<br><br/>Anak akan sangat menyukainya.<br><br/>tas ini adalah produk lokal , kualitas terjamin"
230413328,riadi983,Ready,Juragan,platinum,4h7wend,Celana Jogger Pria Slimfit Olahraga Celana Panjang Santai Joger,Celana Panjang,Baru,3,1,1123,2,1,0,145000,145000,0,bahan cotton twill<br><br/>pola slimfit<br><br/>size 28-34 (S-XL)
230413328,riadi983,Ready,Juragan,platinum,4gtvisv,Tas Ransel Laptop Tas Sekolah Kuliah Kerja Tas Backpack Travelling,Ransel,Baru,5,2,11256,7,2,0,145000,145000,0,TAS KULIT BEST SELLER!!!<br><br/><br><br/>PRODUKSI LOKAL KUALITAS IMPORT<br><br/>BAHAN: KULIT<br><br/>UKURAN:  45cm x 30cm x 18cm <br><br/>TERDAPAT BANYAK RUANGAN <br><br/>RUANGAN UTAMA BESAR DAN TERDAPAT TEMPAT LAPTOP UNTUK UKURAN 15inc<br><br/>JAHITAN RAPIH BAHAN KUAT DAN AWET TAHAN LAMA <br><br/>SANGAT COCOK DIPAKAI UNTUK SEKOLAH/KULIAH/KERJA DAN BERPERGIAN<br><br/>BAGIAN PUNGGUNG DIBUAT SENYAMAN MUNGKIN AGAR NYAMAN SAAT DIGUNAKAN <br><br/>BARANG SELALU DICEK KERAPIHAN DAN KEBERSIHANNYA SEBELUM DIKIRIM KEPADA PEMBELI
230413328,riadi983,Ready,Juragan,platinum,4grj6ma,Celana Olahraga Training Pria Wanita Jogger Celana Sport Sweatpants Joger Fitnes Senam Gym,Celana Olahraga,Baru,4.6,5,1350,21,6,0,100000,100000,0,Bahan baby tery<br><br/>Size <br><br/>S=28-29<br><br/>M=29-30<br><br/>L=31-32<br><br/>Xl=33-34<br><br/>POLA slim<br><br/>barang yang sebelum kami promokan  telah kami cek dan pilih layak jual..karena kepuasan konsumen menjadi hal plg penting dlm system jual beli online.
230413328,riadi983,Ready,Juragan,platinum,3zujthb,Jaket Bomber Pria Dewasa Waterproof Jaket Parka Gunung Windproof Parasut Motor Jaket Sweater Hoodie Jeans Xxl Jumbo Big size Besar Semi Terlaris,Jaket,Baru,5,1,1522,2,10,0,175000,175000,0,WARNA : HITAM<br><br/>- IKAN<br><br/>- TIGER<br><br/>- SAMURAI<br><br/>- BISON<br><br/>- BARONG<br><br/><br><br/>Ready Stock !<br><br/>- Kualits Tebal dan Kuat<br><br/>- Harga Termurah<br><br/>- Cepat Pengiriman<br><br/>- Seller Terpercaya<br><br/>- Bergaransi<br><br/><br><br/>- Jam Operasional Kami : 08.00  16.00 (Senin  Sabtu)<br><br/><br><br/>Spesifikasi Produk :<br><br/>- Gambar Full Bordir<br><br/>- Ready Size M - L - XL - XXL<br><br/>- Bahan luar RZN Waterproof Tebal dan Kuat<br><br/>- Bahan dalam : Tafeta 170 Dan Di Lapisi Busa Dacron Sehingga Terasa Tebal &amp; Hangat.
230413328,riadi983,Ready,Juragan,platinum,3fkmcql,Timbangan Digital Badan Kaca Transparan Body Scale Timbangan Alat Ukur Kesehatan,Timbangan & Alat Ukur Kesehatan,Baru,5,16,12269,16,277,0,140000,140000,0,"Timbangan Badan Digital kaca transparan bentuk bundar / bulat dengan diameter 26 cm, timbangan badan ini mampu mengukur dengan 2 satuan yaitu kilogram (kg) dengan berat maksimal 180 kg toleransi kesalahan 0.1 kg atau berat badan maksimal 369 lb dengan toleransi kesalahan 0.2 lb.<br><br/><br><br/>Berikut ini spesifikasi dari timbangan berat badan digital :<br><br/>- Dapat menimbang dalam dua macam satuan : kilogram dan lb<br><br/>- Ada switch pemilih satuan di belakangnya (bagian dalam)<br><br/>- Angka yang tertera di lacar LCD : 4 Digits<br><br/>- Dioperasikan di suhu normal 10-35 derajat C<br><br/>- Otomatis mati setelah 10 detik tidak dipakai<br><br/>- Ada petunjuk jika berat tidak terbaca, salah, ataupun over<br><br/><br><br/>Cara pemakaian timbangan badan digital :<br><br/>- Pastikan keadaan ON dengan cek switch di bagian belakang sebelah dalam<br><br/>- Setelah ON letakkan timbangan badan digital di permukaan tanah atau lantai yang rata tidak bergelombang<br><br/>- Otomatis menyala, layar LCD akan nyala setelah pengguna berdiri di atasnya, diam dan tahan selama beberapa detik maka timbangan akan mulai mengukur berat badan pengguna"
230413328,riadi983,Ready,Juragan,platinum,3dv0lyi,Meja Lipat Laptop Anti Slip Meja Belajar Anak Colourful Meja Kerja Multi Fungsi Serbaguna,Home Stuff,Baru,5,7,11232,10,93,0,215000,215000,0,"Ready stock dengan ukuran panjang , white &amp;amp; Green.<br><br/><br><br/><br><br/><br><br/>Catatan = anti slip semua warna <br><br/><br><br/>Usage &amp;amp; Benefit<br><br/><br><br/>Meja lipat serba guna, cocok untuk dijadikan sebagai meja laptop, meja belajar, dan lain sebagainya<br><br/><br><br/>Selain memiliki bahan yang halus dan nyaman beserta design yang elegan, meja ini juga dilengkapi dengan slot untuk handphone/tablet &amp;amp; slot gelas (cek variasi).<br><br/><br><br/>Dengan dilengkapinya desain anti air membuat meja ini menjadi pilihan yang terbaik untuk anda!<br><br/><br><br/>Pemasangan gampang dan bisa di lipat, jadi mudah d simpan.<br><br/><br><br/>Hemat ruangan karena portable, mudah di bawa berpergian.<br><br/><br><br/>Anti Slip.<br><br/><br><br/>Siku tidak tajam, aman <br><br/><br><br/>mateial : MDF atau Fiberboard.<br><br/><br><br/>MDF adalah papan material yang tersusun dari kombinasi serat kayu dan serbuk kayu yang dipadatkan dalam tekanan dan temperatur suhu yang tinggi dengan bantuan resin dalam prosesnya.<br><br/><br><br/>MDF sering digunakan untuk furniture kelas menengah keatas.<br><br/><br><br/>Kelebihan MDF :<br><br/><br><br/>- Permukaan lebih halus dan lebih rata<br><br/><br><br/>- Fleksibel dan mudah untuk ditekuk untuk dijadikan alternatif rangka furniture<br><br/><br><br/>- Presisi ketebalan materialnya bagus<br><br/><br><br/>- Memiliki ketahanan yang tinggi"
230413328,riadi983,Ready,Juragan,platinum,3dssh53,Face Shield Pelindung Wajah APD Face Mask Anti Fog Dental Anti Virus Corona Covid 19 Kacamata Masker Safety Full Face Tebal Murah Terlaris,Masker Kesehatan,Baru,5,15,11469,22,236,0,45000,45000,0,Barang ready satu warna sesuai gambar. <br><br/><br><br/>didesign dengan teliti sesuai dengan prosedur kesehatan. <br><br/><br><br/>Specifications:<br><br/><br><br/>- Item type : protective face mask<br><br/><br><br/>- Material : plastic<br><br/><br><br/>- Size : approx 30.5x22x3cm
230413328,riadi983,Ready,Juragan,platinum,33zt4zp,Mukena Bali Dewasa Motif Bunga Mukenah Sholat Wanita Grosir Murah Puasa Lebaran Terlaris Terbaru,Mukena,Baru,5,97,946,114,1554,0,175000,175000,0,Mukena 2in1 Jovanka<br><br/><br><br/>Berat : 640 gram<br><br/>Bahan : Rayon Premium<br><br/>Paket : mukena (atasan+bawahan) + tas pouch<br><br/><br><br/>Detail Ukuran:<br><br/>Panjang Atasan :<br><br/>Depan : 128cm (kurang lebih)<br><br/>Belakang : 140cm (kurang lebih)<br><br/>Panjang resleting : kurang lebih 40 cm<br><br/>(kurang lebih)<br><br/>Tali kepala : ikat<br><br/><br><br/>Bawahan :<br><br/>Panjang : 110cm (kurang lebih)<br><br/>Lebar : 78cm (kurang lebih)<br><br/>Tas : 28 cm x 19 cm<br><br/>tas memakai resleting
230413328,riadi983,Ready,Juragan,platinum,33zrqjg,Mukena Bali Terusan Dewasa Mukenah Sholat Motif Terbaru,Mukena,Baru,5,97,953,110,1547,0,145000,145000,0,WARNA: <br><br/>COKSU<br><br/>NAVY<br><br/>HIJAU SEMEN<br><br/>HITAM<br><br/>ABU<br><br/>LAVENDER<br><br/><br><br/>MUKENA TRAVELLING TERUSAN ROSIANA<br><br/><br><br/> BAHAN : RAYON PREMIUM<br><br/> PANJANG : 185CM<br><br/> LINGKAR DADA : 170 CM<br><br/> BERAT : 460 GRAM<br><br/> TAS : 20 X 15<br><br/> SET MUKENA + TAS<br><br/><br><br/>TAS BERBENTUK POUCH YG MUDAH DIBAWA KEMANA SAJA DAN MOTIF SIMPEL<br><br/><br><br/>Motif gambar pada kain merupakan printing
