id_seller,username,nama_toko,level_toko,premium_toko,id_produk,nama_produk,kategori,kondisi,rating,jumlah_rating,stok,jumlah_interest,jumlah_sold,jumlah_view,harga,harga_asli,diskon,deskripsi
230413328,riadi983,Ready,Juragan,platinum,305x1qb,Baju Syari Wanita Gamis Maxi Maxy Busui Kancing Busana Dress Terbaru,Dress,Baru,5,61,11237,66,566,0,275000,275000,0,WARNA : <br><br/>LAVENDER<br><br/>ABU<br><br/>PINK<br><br/>HIJAU<br><br/>COKSU<br><br/>COKLAT<br><br/>NAVY<br><br/>MARON<br><br/>LILAC<br><br/>HITAM<br><br/>SALEM<br><br/><br><br/>Mohon Di Baca Dulu Deskripsi <br><br/>-Gamis Yumna Free Masker Brukat <br><br/>-Gamis Full Brukat Tile<br><br/>Lapis Bahn Maxmara Velvet<br><br/>-Sleting Belakang<br><br/>-Tali Pinggang Kiri Kanan Jahit Tempel<br><br/>-Depan Combi Layer Tile Polos Kiri Kanan<br><br/><br><br/>Tersedia ukuran :<br><br/>Ukuran M<br><br/>Lingkar Dada 90 Cm<br><br/>Panjang Gamis 140 Cm<br><br/>Lingkar Ketiak 46 Cm<br><br/>Panjang Tangan 59 Cm<br><br/>Lebar Bawah 182 Cm<br><br/><br><br/>Ukuran L<br><br/>Lingkar Dada 100 Cm<br><br/>Panjang Gamis 140 Cm<br><br/>Lingkar Ketiak 48 Cm<br><br/>Panjang Tangan 59 Cm<br><br/>Lebar Bawah 184 Cm<br><br/><br><br/>Ukuran XL<br><br/>Lingkar Dada 110 Cm<br><br/>Panjang Gamis 140 Cm<br><br/>Lingkar Ketiak 50 Cm<br><br/>Panjang Tangan 60 Cm<br><br/>Lebar Bawah 192 Cm<br><br/><br><br/>Ukuran XXL<br><br/>Lingkar Dada 120 Cm<br><br/>Panjang Gamis 140 Cm<br><br/>Lingkar Ketiak 54 Cm<br><br/>Panjang Tangan 60 Cm<br><br/>Lebar Bawah 200 Cm
230413328,riadi983,Ready,Juragan,platinum,305vbyk,Gamis Syari Wanita Baju Muslim Dress Dewasa Busana Gaun Pesta Lebaran Terbaru,Dress,Baru,5,61,1251,68,571,0,126000,126000,0,"Bahan : moscrepe<br><br/>Ld : 102cm<br><br/>pb;136 cm<br><br/>allsize fit L besar<br><br/>plus hijab<br><br/>Selamat datang di toko kami<br><br/>Open reseller, dropship,<br><br/>Kemiripan gambar 90% karena akan ada perbedaan warna saat pengambilan gambar. Efek dari kamera dan flash. <br><br/>Cantumkan warna cadangan karena stok repeat cepat  kebetulan pesanan yang anda pesan kosong akan secepatnya kami konfirmasi melalui chat"
230413328,riadi983,Ready,Juragan,platinum,305szan,Busana Muslim Wanita Dewasa Gamis Syari Gaun Pesta Lebaran Terbaru,Dress,Baru,5,159,1245,185,2329,0,125000,125000,0,"Bahan :moscrepe<br><br/>Ld : 102 cm<br><br/>PB : 136 cm<br><br/>allsize fit L<br><br/>Selamat datang di toko kami.<br><br/>Open reseller, dropship,<br><br/>Kemiripan gambar 90% karena akan ada perbedaan warna saat pengambilan gambar. Efek dari kamera dan flash. <br><br/>Cantumkan warna cadangan karena stok repeat cepat  kebetulan pesanan yang anda pesan kosong akan secepatnya kami konfirmasi melalui chat"
230413328,riadi983,Ready,Juragan,platinum,305rvot,Gamis Syari Muslim Baju Wanita Dewasa Jubah Dress Maxi Busana Gaun Pesta Lebaran Maxy Terbaru,Dress,Baru,5,155,1249,190,2328,0,150000,150000,0,"MODEL :<br><br/>Cordy Dress<br><br/>.<br><br/>SPESIFIKASI<br><br/>- Bahan Moscrepe Halus<br><br/>- Bahan nyaman tidak lepek, dan tidak mudah kusut<br><br/>- Jahitan rapih<br><br/>- Tambahan layer tile agar tampak semakin mewah<br><br/>.<br><br/>SIZE :<br><br/>Ukuran L<br><br/>LD : 106 cm<br><br/>PB : 135 cm<br><br/>.<br><br/>PILIHAN WARNA<br><br/>- Choco<br><br/>- Mustard<br><br/>- Grey<br><br/>- Mauve"
230413328,riadi983,Ready,Juragan,platinum,303kb9x,Gamis Syari Muslim Baju Wanita Long Dress Formal Busana Pesta Lebaran Jubah Dewasa Terlaris Terbaru,Dress,Baru,5,253,1240,355,4133,0,125000,125000,0,WARNA: <br><br/>HITAM<br><br/>ARMY<br><br/>CARAMEL<br><br/><br><br/>Bahan :moscrepe<br><br/>Ld : 104 cm<br><br/>PB : 136 cm<br><br/>plus hijab
230413328,riadi983,Ready,Juragan,platinum,30031wk,Gamis Syari Wanita Dewasa Busana Muslim Jubah Dress Pesta Lebaran Grosir Murah Premium Terbaru,Dress,Baru,5,247,269,301,4050,0,139000,139000,0,"MODEL :<br><br/>Aurel Dress<br><br/>.<br><br/>SPESIFIKASI<br><br/>- Bahan Moscrepe Halus<br><br/>- Bahan nyaman tidak lepek, dan tidak mudah kusut<br><br/>- Jahitan rapih<br><br/>- Resleting depan busi friendly<br><br/>- Brukat di bagian tengah<br><br/>- Tangan model Batwing<br><br/>.<br><br/>SIZE :<br><br/>Ukuran L<br><br/>LD : 110 cm<br><br/>PB : 135 cm<br><br/>.<br><br/>PILIHAN WARNA<br><br/>- Lavender<br><br/>- Dusty<br><br/>- Mocca<br><br/>- Maroon"
230413328,riadi983,Ready,Juragan,platinum,2zzcanc,Gamis Syari Wanita Baju Muslim Dewasa Jubah Busana Dress Pesta Lebaran Grosir Murah Terbaru,Dress,Baru,4.9,253,217,332,4062,0,110000,110000,0,GAMIS WULAN<br><br/><br><br/>MOTIF BANYAK PILIHAN YAH !!! GESER KE KIRI &gt;&gt;&gt;<br><br/>DI FOTO ADA NO PILIHAN NYA YAH<br><br/><br><br/>BAHAN : MOSCREPE<br><br/>LINGKAR DADA : 114 CM<br><br/>PANJANG GAMIS : 140 CM<br><br/>LEBAR BAWAH : 230 CM<br><br/>BUSUI FRIENDLY : SLETING DEPAN<br><br/>ADA SAKU KANAN KIRI<br><br/>PINGGANG ADA TALI<br><br/>TANGAN KARET<br><br/><br><br/><br><br/>coksu<br><br/>dusty<br><br/>maron<br><br/>hitam<br><br/>navy<br><br/>tosca<br><br/>abu tua <br><br/>ungu muda <br><br/>kuning<br><br/>army<br><br/>biru<br><br/>putih
230413328,riadi983,Ready,Juragan,platinum,2zz9iby,Baju Gamis Wanita Dress Syari Dewasa Jubah Maxy Busana Muslim Terbaru,Dress,Baru,5,59,1247,60,570,0,155000,155000,0,WARNA :<br><br/>MILO<br><br/>MARON<br><br/>LIGHT GREY<br><br/>DARK GREY<br><br/>MOCCA<br><br/>ARMY<br><br/>Ukuran     : Panjang Badan   : 136 cm<br><br/>                  :Lebar Dada          : 102 Cm<br><br/>                  : Bahan                  : Moscrepe<br><br/>                  : panjang Lengan : 58 Cm<br><br/> Dress Saja Tanpa Hijab
230413328,riadi983,Ready,Juragan,platinum,2zz7wj9,Gamis Syari Wanita Dewasa Set Hijab Baju Lebaran Busana Jubah Dress Muslim Grosir Murah Terbaru,Dress,Baru,4.9,284,1251,379,4121,0,125000,125000,0,"Bahan :moscrepe<br><br/><br><br/><br><br/><br><br/>Ld : 102 cm<br><br/><br><br/><br><br/><br><br/>PB : 136 cm<br><br/><br><br/><br><br/><br><br/>allsize fit L<br><br/><br><br/><br><br/><br><br/>Selamat datang di toko Ready <br><br/><br><br/><br><br/><br><br/>Open reseller, dropship,<br><br/><br><br/><br><br/><br><br/>Kemiripan gambar 90% karena akan ada perbedaan warna saat pengambilan gambar. Efek dari kamera dan flash. <br><br/><br><br/><br><br/><br><br/>Cantumkan warna cadangan karena stok repeat cepat  kebetulan pesanan yang anda pesan kosong akan secepatnya kami konfirmasi melalui chat"
230413328,riadi983,Ready,Juragan,platinum,2zz688f,Baju Gamis Wanita Syari Busana Dress Muslim Pesta Lebaran Sale Grosir Murah Premium Terbaru,Dress,Baru,5,62,12541,64,549,0,123000,123000,0,"Bahan :moscrepe<br><br/>Ld : 102 cm<br><br/>PB : 136 cm<br><br/>allsize Fit L  plus hijab<br><br/>Selamat datang di toko Ready<br><br/>Open reseller, dropship,<br><br/>Kemiripan gambar 90% karena akan ada perbedaan warna saat pengambilan gambar. Efek dari kamera dan flash. <br><br/>Cantumkan warna cadangan karena stok repeat cepat  kebetulan pesanan yang anda pesan kosong akan secepatnya kami konfirmasi melalui chat"
230413328,riadi983,Ready,Juragan,platinum,2zyzdvt,Baju Gamis Syari Wanita Dewasa Set Hijab Busana Dress Muslim Terbaru,Busana Muslim Wanita,Baru,4.9,62,1288,89,576,0,125000,125000,0,"Bahan : moscrepe<br><br/>Ld : 102cm<br><br/>pb;136 cm<br><br/>allsize fit L besar<br><br/>plus hijab<br><br/>Selamat datang di toko Ready <br><br/>Open reseller, dropship,<br><br/>Kemiripan gambar 90% karena akan ada perbedaan warna saat pengambilan gambar. Efek dari kamera dan flash. <br><br/>Cantumkan warna cadangan karena stok repeat cepat  kebetulan pesanan yang anda pesan kosong akan secepatnya kami konfirmasi melalui chat"
230413328,riadi983,Ready,Juragan,platinum,2zo49hd,Gamis Syari Wanita Set Hijab Dress Baju Jubah Busana Muslim Busui Terbaru,Busana Muslim Wanita,Baru,4.9,156,2188,317,1848,0,145000,145000,0,WARNA :<br><br/><br><br/>ARMY<br><br/>KUNING <br><br/>HIJAU BOTOL<br><br/>PINK DUSTY<br><br/>LATTE<br><br/>UNGU<br><br/>SALEM<br><br/>PUTIH<br><br/>ABU<br><br/>MARON<br><br/>HITAM<br><br/>NAVY<br><br/>MILO<br><br/>LILAC<br><br/>CHOCOLATE <br><br/>KUNING LEMON<br><br/><br><br/>INFO : TOLONG KONFIRMASI WARNA VIA CHAT ATAU KASI WARNA CADANGAN <br><br/><br><br/>Ukuran AllSize L @ Lebar Dada : 104 Cm<br><br/>@ Panjang Badan : 136 Cm<br><br/><br><br/>Ukuran XL @ Lebar Dada : 110 Cm<br><br/>@ Panjang Badan : 138 Cm<br><br/><br><br/>Ukuran XXL @ Lebar Dada : 120 Cm<br><br/>@ Panjang Badan :142 Cm<br><br/>@ Bahan : Moscrepe<br><br/>@ Plus Hijab Semua Ukuran<br><br/>@ Resleting Depan / Busui
230413328,riadi983,Ready,Juragan,platinum,2tcb88f,Baju Koko Muslim Gamis Kurta Lengan Panjang Qurta Kemeja Pakistan Puasa Lebaran Sholat Fashion Sale Grosir Murah Terlaris Terbaru Original,Busana Muslim Pria,Baru,5,36,2347,51,635,0,152000,152000,0,WARNA : <br><br/>PUTIH<br><br/>HITAM<br><br/>NAVY<br><br/>MARON<br><br/>HIJAU<br><br/>ARMY<br><br/>CREAM<br><br/>ABU<br><br/><br><br/>Baju koko ANWA<br><br/>Lengan panjang<br><br/>Bahan cotton TOYOBO premium<br><br/>Bahan tidak melar<br><br/>Ada kantong asli<br><br/><br><br/>Tersedia 5 ukuran<br><br/>S=LD100cm PJ76cm<br><br/>M=LD104cm PJ81cm<br><br/>L=LD106cm PJ83cm<br><br/>XL=LD108cm PJ85cm<br><br/>XXL=LD110cm PJ87cm
230413328,riadi983,Ready,Juragan,platinum,2tbuics,Baju Muslim Kurta Pakistan Gamis Pria Koko Kemeja Fashion Distro Promo Best Seller Grosir Termurah Original Lebaran Puasa Terlaris,Busana Muslim Pria,Baru,4.9,41,2348,100,656,0,144000,144000,0,"Baju koko MODEN<br><br/>Lengan pendek<br><br/>Bahan cotton TOYOBO premium<br><br/>Bahan tidak melar<br><br/>Ada kantong asli<br><br/><br><br/>Terseida 4 ukuran<br><br/>M=LD104cm PJ79cm<br><br/>L=LD108cm PJ81cm<br><br/>XL=LD112cm PJ83cm<br><br/>XXL=LD116cm PJ85cm<br><br/><br><br/>1pcs = 300gram<br><br/>4pcs= 1kilogram<br><br/><br><br/>(Setiap produk memiliki toleransi jahit 2 - 4 cm , pastikan membeli produk untuk mengukur terlebih dahulu. Jgn memaksakan produk dengan ukuran yang pas)<br><br/>Warna :<br><br/>putih<br><br/>abu<br><br/>navy<br><br/>maron<br><br/>hitam<br><br/>army<br><br/>hijau<br><br/><br><br/><br><br/>Terimakasih Sudah Singgah di Toko Yang Tepat Dengan Produk Terbaik dan Harga Terjangkau"
230413328,riadi983,Ready,Juragan,platinum,2tbs8uh,Baju Koko Kurta Pakistan Hoodie Muslim Pria Gamis Kemeja  Distro Murah Sholat Lebaran Grosir Puasa Original Terlaris Terbaru,Busana Muslim Pria,Baru,5,47,351,130,649,0,123000,123000,0,WARNA : <br><br/>PUTIH<br><br/>MARON<br><br/>NAVY<br><br/>ABU<br><br/>KHAKI<br><br/>HITAM<br><br/>Baju koko NOBU<br><br/>Bahan toyobo tebal premium<br><br/>Lengan pendek<br><br/>ada kantong aktif<br><br/>saku kiri kanan aktif<br><br/>tersedia 3 pilihan ukuran<br><br/>S-Lingkar dada 102cm panjang 70cm<br><br/>M-Lingkar dada 106cm panjang 72cm<br><br/>L=Lingkar dada 110cm panjang 74cm<br><br/>Tersedia banyak pilihan warna sesuai di foto
230413328,riadi983,Ready,Juragan,platinum,2t9xcyv,Jaket Cagoule Bgsr Pria Bomber Hoodie Waterproof Anti Air Grosir Parka Taslan Sweater Premium Terbaru Terlaris,Jaket,Baru,5,972,1235,706,9878,0,250000,250000,0,"Jenis Product : Sweater<br><br/>	Warna : Mustard<br><br/>	Premium soft cotton model berkualitas Internasional<br><br/>	Metode jahit double rantai standar Internasional<br><br/>	High quality print plastisol, Rubbeer, Transfer printing dengan cat / bahan aman untuk dipakai sehari hari<br><br/>	Bebas toxid<br><br/>	Desain Trendy<br><br/>	Round neckline<br><br/><br><br/>Size Chart<br><br/>Panjang Badan x 1/2 Lingkar Badan (cm)<br><br/>- L: 72 x 59.5<br><br/>- XL : 74 x 61.5"
230413328,riadi983,Ready,Juragan,platinum,2os6vzo,Celana Jogger Pria Joger Chino Panjang Terbaru Pants Sweatpants Cargo  Casual Original Training Sport Olahraga Terlaris Premium,Celana Panjang,Baru,5,1387,1539,728,16497,0,160000,160000,0,Celan Jogger <br><br/><br><br/>Bahan cotton twill<br><br/><br><br/>Jahitan dijamin rapih dan kuat<br><br/>Nyama di pakai/Tidak Panas di pakai<br><br/><br><br/>Harga terjangkau kualitas di jamin ga murahan<br><br/><br><br/>Cocok di gunakan untuk naik gunung maupun untuk sehari-hari<br><br/><br><br/>Membuat anda tampil modis dan sporty<br><br/><br><br/>Ukuran Normal Asia<br><br/><br><br/>S : 27-28 ( lp 72 cm x p 95 cm )<br><br/><br><br/><br><br/><br><br/>M : 29-30 (lp 78 cm x p 97 cm)<br><br/><br><br/><br><br/><br><br/>L : 31-32 (lp 82 cm x p 100 cm)<br><br/><br><br/><br><br/><br><br/>XL : 33-34 (lp 87 cm x p 100 cm)<br><br/><br><br/><br><br/><br><br/>XXL : 35-36 ( lp 95 cm x 102 cm )<br><br/><br><br/><br><br/>warna :<br><br/><br><br/>green<br><br/><br><br/>brown<br><br/><br><br/>white<br><br/><br><br/>gray<br><br/><br><br/>10000 Barang di jamin REALPICT &amp;amp;amp;amp; BARU<br><br/><br><br/>we wait your choice...<br><br/><br><br/>Happy Shopping gan.. ..!!!
230413328,riadi983,Ready,Juragan,platinum,2o6aj5y,Jaket Sweater Hoodie Pria Wanita Unisex Jaket Jumper Casual Promo Jaket Bomber Parka Kaos Lengan Panjang Pria Dewasa Cowok Terbaru,Sweater,Baru,4.9,14,985,23,265,0,164000,164000,0,"Geser foto untuk detail produ<br><br/><br><br/>(UNISEX)<br><br/>MATERIAL : BABY CANVAS MIX FURING<br><br/><br><br/>SIZE : L FIT XL<br><br/>Kurang lebih ( P 74cm L 58cm )<br><br/><br><br/>BERAT : 800 GRAM<br><br/><br><br/><br><br/>BARANG DIJAMIN SESUAI DENGAN PHOTO<br><br/><br><br/>"" KAMI JUAL, ANDA BELI ""<br><br/><br><br/>#Jaketsweater#Jakethoodie#Jaketbomber#Jaketsemikulit#Jaketmotor#Grosirjaket#Jaketdistro#Jaketoriginal#Jaketbukalapak"
230413328,riadi983,Ready,Juragan,platinum,2o63933,Jaket Bomber Semi Kulit Pria Jaket Motor Pilot Karlit Jaket Polos Waterproof Tahan Air Anti Air Jaket Distro Original,Jaket,Baru,4.9,13,1250,30,241,0,168000,168000,0,"WARNA :<br><br/>HITAM<br><br/>COKLAT TAN<br><br/><br><br/>Ready Stock !<br><br/>- Kualits Tebal dan Kuat<br><br/>- Harga Termurah<br><br/>- Cepat Pengiriman<br><br/>- Seller Terpercaya<br><br/>- Bergaransi<br><br/>- Jam Operasional Kami : 08.00  16.00 (Senin  Sabtu)<br><br/><br><br/>UNTUK SIZE TERSEDIA <br><br/>SIZE : M , L , XL<br><br/>Bahan : Vienna<br><br/><br><br/>UKURAN <br><br/>M : <br><br/>Panjang badan : 63cm <br><br/>Panjang lengan : 58cm <br><br/>Lebar dada : 52cm<br><br/>Lebar bahu : 47cm<br><br/><br><br/>L : <br><br/>Panjang badan : 65cm<br><br/>Panjang lengan : 61cm <br><br/>Lebar dada : 54cm<br><br/>Lebar bahu : 51cm<br><br/><br><br/>XL : <br><br/>Panjang badan : 67cm <br><br/>Panjang lengan : 63cm <br><br/>Lebar dada : 57cm<br><br/>Lebar bahu :53cm<br><br/><br><br/>XXL : <br><br/>Panjang badan : 69cm <br><br/>Panjang lengan : 65cm <br><br/>Lebar dada : 59cm<br><br/>Lebar bahu :55cm<br><br/><br><br/>Langsung aja klik beli, sebelum kehabisan.<br><br/><br><br/>"" KAMI JUAL, ANDA BELI ""<br><br/><br><br/>#Jaketbomber#Jaketsemikulit#Jaketmotor#Grosirjaket#Jaketdistro#Jaketoriginal#Jaketbukalapak"
230413328,riadi983,Ready,Juragan,platinum,2o5zj32,Jaket Gunung Pria Jaket Parka Hoodie Taslan Jaket Bomber Parasut Motor Waterproof Original Terbaru,Jaket,Baru,5,1177,1424,983,14559,0,156000,156000,0,"Ready lagi gan, produk terbaru kami gan, jaket gunung,  juga tentunya ori ya gan. <br><br/><br><br/><br><br/><br><br/>bahan parasut taslan<br><br/><br><br/><br><br/><br><br/>size <br><br/><br><br/><br><br/><br><br/>m <br><br/><br><br/><br><br/><br><br/>L <br><br/><br><br/><br><br/><br><br/>XL<br><br/><br><br/><br><br/><br><br/>POLA SLIMFIT<br><br/><br><br/><br><br/><br><br/>barang yang sebelum kami promokan telah kami cek dan pilih layak jual..karena kepuasan konsumen menjadi hal plg penting dlm system jual beli online.<br><br/><br><br/><br><br/><br><br/><br><br/><br><br/><br><br/><br><br/>stock terbatas<br><br/><br><br/><br><br/><br><br/><br><br/><br><br/><br><br/><br><br/>diwajibkan menanyakan dulu stock<br><br/><br><br/><br><br/><br><br/><br><br/><br><br/><br><br/><br><br/>sebelum order..untuk meminimalisir refund<br><br/><br><br/><br><br/><br><br/><br><br/><br><br/><br><br/><br><br/>Warna:<br><br/><br><br/><br><br/><br><br/>maron abu<br><br/><br><br/><br><br/><br><br/>abu maron<br><br/><br><br/><br><br/><br><br/>hitam abu<br><br/><br><br/><br><br/><br><br/>abu hitam<br><br/><br><br/><br><br/><br><br/>abu biru<br><br/><br><br/><br><br/><br><br/>biru abu<br><br/><br><br/><br><br/><br><br/>maron tangn hitam<br><br/><br><br/><br><br/><br><br/>hitam maron<br><br/><br><br/><br><br/><br><br/><br><br/><br><br/><br><br/><br><br/>"" KAMI JUAL, ANDA BELI """
230413328,riadi983,Ready,Juragan,platinum,2o5x50b,Celana Jogger Joger Pria Panjang Sweatpants Celana Pria Bikers Celana Gunung Hiking Cargo Chino Training Olahraga Celana Korea Original Terbaru,Celana Panjang,Baru,5,829,1105,597,11949,0,154500,154500,0,"Ready lagi gan, produk terbaru kami gan, celana Jogger, juga tentunya ori ya gan. <br><br/><br><br/><br><br/><br><br/><br><br/><br><br/><br><br/><br><br/><br><br/><br><br/><br><br/><br><br/><br><br/><br><br/><br><br/><br><br/>bahan cotton twill<br><br/><br><br/><br><br/><br><br/><br><br/><br><br/><br><br/><br><br/><br><br/><br><br/><br><br/><br><br/><br><br/><br><br/><br><br/><br><br/>size s (28-29)<br><br/><br><br/><br><br/><br><br/><br><br/><br><br/><br><br/><br><br/><br><br/><br><br/><br><br/><br><br/><br><br/><br><br/><br><br/><br><br/>m (29-30)<br><br/><br><br/><br><br/><br><br/><br><br/><br><br/><br><br/><br><br/><br><br/><br><br/><br><br/><br><br/><br><br/><br><br/><br><br/><br><br/>L (31-32)<br><br/><br><br/><br><br/><br><br/><br><br/><br><br/><br><br/><br><br/><br><br/><br><br/><br><br/><br><br/><br><br/><br><br/><br><br/><br><br/>XL(33-34)<br><br/><br><br/><br><br/><br><br/><br><br/><br><br/><br><br/><br><br/><br><br/><br><br/><br><br/><br><br/><br><br/><br><br/><br><br/><br><br/>POLA SLIMFIT<br><br/><br><br/><br><br/><br><br/><br><br/><br><br/><br><br/><br><br/><br><br/><br><br/><br><br/><br><br/><br><br/><br><br/><br><br/><br><br/>barang yang sebelum kami promokan telah kami cek dan pilih layak jual..karena kepuasan konsumen menjadi hal plg penting dlm system jual beli online.<br><br/><br><br/><br><br/><br><br/><br><br/><br><br/><br><br/><br><br/><br><br/><br><br/><br><br/><br><br/><br><br/><br><br/><br><br/><br><br/><br><br/><br><br/><br><br/><br><br/><br><br/><br><br/><br><br/><br><br/><br><br/><br><br/><br><br/><br><br/><br><br/><br><br/><br><br/><br><br/>stock terbatas<br><br/><br><br/><br><br/><br><br/><br><br/><br><br/><br><br/><br><br/><br><br/><br><br/><br><br/><br><br/><br><br/><br><br/><br><br/><br><br/><br><br/><br><br/><br><br/><br><br/><br><br/><br><br/><br><br/><br><br/><br><br/><br><br/><br><br/><br><br/><br><br/><br><br/><br><br/><br><br/>diwajibkan menanyakan dulu stock<br><br/><br><br/><br><br/><br><br/><br><br/><br><br/><br><br/><br><br/><br><br/><br><br/><br><br/><br><br/><br><br/><br><br/><br><br/><br><br/><br><br/><br><br/><br><br/><br><br/><br><br/><br><br/><br><br/><br><br/><br><br/><br><br/><br><br/><br><br/><br><br/><br><br/><br><br/><br><br/>sebelum order..untuk meminimalisir refund<br><br/><br><br/><br><br/><br><br/><br><br/><br><br/><br><br/><br><br/><br><br/><br><br/><br><br/><br><br/><br><br/><br><br/><br><br/><br><br/><br><br/><br><br/><br><br/><br><br/><br><br/><br><br/><br><br/><br><br/><br><br/><br><br/><br><br/><br><br/><br><br/><br><br/><br><br/><br><br/>Warna:<br><br/><br><br/><br><br/><br><br/><br><br/><br><br/><br><br/><br><br/><br><br/><br><br/><br><br/><br><br/><br><br/><br><br/><br><br/><br><br/>hitam<br><br/><br><br/><br><br/><br><br/><br><br/><br><br/><br><br/><br><br/><br><br/><br><br/><br><br/><br><br/><br><br/><br><br/><br><br/><br><br/>abu<br><br/><br><br/><br><br/><br><br/><br><br/><br><br/><br><br/><br><br/><br><br/><br><br/><br><br/><br><br/><br><br/><br><br/><br><br/><br><br/><br><br/><br><br/><br><br/><br><br/><br><br/><br><br/><br><br/><br><br/><br><br/><br><br/><br><br/><br><br/><br><br/><br><br/><br><br/><br><br/>"" KAMI JUAL, ANDA BELI ""<br><br/><br><br/><br><br/><br><br/><br><br/><br><br/><br><br/><br><br/><br><br/><br><br/><br><br/><br><br/><br><br/><br><br/><br><br/><br><br/><br><br/><br><br/><br><br/><br><br/><br><br/><br><br/><br><br/><br><br/><br><br/><br><br/><br><br/><br><br/><br><br/><br><br/><br><br/><br><br/>#CelanaJogger #Celanajoger #CelanaPria #Celanachino #Celanacargo #celanaoriginal #Celanaterbaru #Celanaterlaris #Sweatpants #Salepromo #Fashionpria #Celanajeans #Bukalapak"
230413328,riadi983,Ready,Juragan,platinum,2o5njcf,Celana Jogger Pria Panjang Celana Joger Pants Celana Jogger Chino Terbaru Cargo Strip Korea Original,Celana Panjang,Baru,5,778,12428,398,11758,0,155000,155000,0,"Bahan cotton twill Mona<br><br/>Size 27-34<br><br/>S =27-28<br><br/>M=29-30<br><br/>L=31-32<br><br/>XL=34<br><br/>Pola slim<br><br/>Warna<br><br/>hitam<br><br/>abu<br><br/>"" KAMI JUAL, ANDA BELI ""<br><br/>#CelanaJogger #Celanajoger #CelanaPria #Celanachino #Celanacargo #celanaoriginal #Celanaterbaru #Celanaterlaris #Sweatpants #Salepromo #Fashionpria #Celanajeans #Bukalapak"
230413328,riadi983,Ready,Juragan,platinum,2o5kf68,Celana Jogger Pria Panjang Pendek Celana Jogger Cargo Pants Celana Joger Bikers Slimfit Celana Chino Gunung Hiking Original Terbaru,Celana Panjang,Baru,5,1276,12525,626,13242,0,158000,158000,0,"Ready lagi gan, produk terbaru kami gan, juga tentunya ori ya gan. <br><br/><br><br/><br><br/><br><br/><br><br/><br><br/><br><br/><br><br/>bahan cotton twill<br><br/><br><br/><br><br/><br><br/><br><br/><br><br/><br><br/><br><br/>size s (28-29)<br><br/><br><br/><br><br/><br><br/><br><br/><br><br/><br><br/><br><br/>m (29-30)<br><br/><br><br/><br><br/><br><br/><br><br/><br><br/><br><br/><br><br/>L (31-32)<br><br/><br><br/><br><br/><br><br/><br><br/><br><br/><br><br/><br><br/>XL(33-34)<br><br/><br><br/><br><br/><br><br/><br><br/><br><br/><br><br/><br><br/>POLA SLIMFIT<br><br/><br><br/><br><br/><br><br/><br><br/><br><br/><br><br/><br><br/>barang yang sebelum kami promokan telah kami cek dan pilih layak jual..karena kepuasan konsumen menjadi hal plg penting dlm system jual beli online.<br><br/><br><br/><br><br/><br><br/><br><br/><br><br/><br><br/><br><br/><br><br/><br><br/><br><br/><br><br/><br><br/><br><br/><br><br/><br><br/>stock terbatas<br><br/><br><br/><br><br/><br><br/><br><br/><br><br/><br><br/><br><br/><br><br/><br><br/><br><br/><br><br/><br><br/><br><br/><br><br/><br><br/>diwajibkan menanyakan dulu stock<br><br/><br><br/><br><br/><br><br/><br><br/><br><br/><br><br/><br><br/><br><br/><br><br/><br><br/><br><br/><br><br/><br><br/><br><br/><br><br/>sebelum order..untuk meminimalisir refund<br><br/><br><br/><br><br/><br><br/><br><br/><br><br/><br><br/><br><br/><br><br/><br><br/><br><br/><br><br/><br><br/><br><br/><br><br/><br><br/>Warna:<br><br/><br><br/><br><br/><br><br/><br><br/><br><br/><br><br/><br><br/>hitam<br><br/><br><br/><br><br/><br><br/><br><br/><br><br/><br><br/><br><br/>abu<br><br/><br><br/><br><br/><br><br/><br><br/><br><br/><br><br/><br><br/><br><br/><br><br/><br><br/><br><br/><br><br/><br><br/><br><br/><br><br/>"" KAMI JUAL, ANDA BELI ""<br><br/><br><br/><br><br/><br><br/><br><br/><br><br/><br><br/><br><br/><br><br/><br><br/><br><br/><br><br/><br><br/><br><br/><br><br/><br><br/>#CelanaJogger#Celanajoger #CelanaPria#Celanachino #Celanacargo#celanaoriginal #Celanaterbaru#Celanaterlaris #Sweatpants#Salepromo #Fashionpria#Celanajeans #Celanabikers#Bukalapak"
230413328,riadi983,Ready,Juragan,platinum,2h65bd7,Celana Pendek Chino Pria Celana Casual Pria Skinny Slimfit Celana Pria Dewasa Pendek Pants Celana Cargo Katun Jogger Jeans Levis Premium Original,Celana Pendek,Baru,5,17,928,30,72,0,185000,185000,0,Bahan : Cotton<br><br/>Model : Slimfit<br><br/><br><br/>Ukuran :<br><br/>S   : 28<br><br/>M  : 29-30<br><br/>L   : 31-32<br><br/>XL : 33-34<br><br/><br><br/>Warna :<br><br/>hitam<br><br/>abu muda<br><br/>abu tua<br><br/>coklat<br><br/>green army<br><br/>mocca<br><br/>cream<br><br/><br><br/>Silahkan diorder ya.....!<br><br/>Happy Shopping &amp; Thank you !
230413328,riadi983,Ready,Juragan,platinum,2h63khl,Celana Jeans Pria Wrangler Skinny Celana Pria Levis Panjang Slimfit Dewasa Celana Chino Jogger Casual Terlaris Premium Original,Jeans,Baru,4.8,50,484,75,516,0,259000,259000,0,Size Chart silahkan chat kami.<br><br/>Jam Operasional Toko :<br><br/>Senin - Jumat : 08:00  15:00<br><br/><br><br/>1/2 Lingkar pinggang x 1/2 lingkar pinggul x front rise x inseam (cm)<br><br/>- 27 : 35 x 42 x 20 x 77<br><br/>- 28 : 35.50 x 42 x 20.50 x 76 <br><br/>- 29 : 37 x 44 x 21 x 76<br><br/>- 30 : 38 x 45 x 21.50 x 76<br><br/>- 31 : 40.70 x 45.80 x 22 x 76<br><br/>- 32 : 42 x 47 x 22.50 x 76.50<br><br/>- 33 : 41.25 x 48 x 23.50 x 76.50<br><br/>- 34 : 42.50 x 49.50 x 24 x 76.50<br><br/>- 36 : 45.70 x 52 x 26 x 77.50
230413328,riadi983,Ready,Juragan,platinum,2h2wrnn,Jaket Pria Bomber Big Size Jaket Bomber XXL Jaket Jumbo Sensor Jaket Parasut Parka Jaket Hoodie Casual Jaket Sweater Original Kekinian Terbaru,Jaket,Baru,4.7,51,12441,182,387,0,175000,175000,0,Bahan scoot puma (anti air)<br><br/>Banyak Pilihan Warna<br><br/>Ukuran XL-XXL<br><br/>Detail ukuran panjang x lebar dada :<br><br/>XL.panjang 68cm x lebar dada 58cm<br><br/>XXL.panjang 70cm lebar dada 60cm<br><br/>Jaket menggunakan resleting ada saku di bagian depan dan dalam nya<br><br/>Menggunakan bordir di bagian dada SENSOR<br><br/>Bahan adem di  berbulu dan tidak luntur lagi<br><br/>Bagus di gunakan di kalangan usia<br><br/>Model polos simple bisa di gunakan di berbagai kegiatan<br><br/>Kwalitas 99% realpict sesui photo<br><br/>Produk asli dalam negri bandung<br><br/>Best produk recomendeed<br><br/>Stok masih tersedia<br><br/><br><br/>Warna :<br><br/>Black<br><br/>Navy<br><br/>Green
